[
    {
        "unique_id": "kpzpQpHnMDNwNT7wmkMBD",
        "card_unique_id": "nrMg9kDMg9KwBPPtJLJph",
        "status_active": true,
        "date_announced": "2022-10-03T00:00:00.000Z",
        "date_in_effect": "2022-10-07T00:00:00.000Z",
        "legality_article": "https://fabtcg.com/articles/banned-suspended-oct-3/"
    }
]