[
    {
        "unique_id": "mzJKMmjwtkBzThtDFrmFQ",
        "card_unique_id": "phCFwdjG8dKDCmr7d7F7M",
        "status_active": true,
        "date_announced": "2023-12-18T00:00:00.000Z",
        "date_in_effect": "2023-12-22T00:00:00.000Z",
        "legality_article": "https://fabtcg.com/articles/scheduled-banned-and-restricted-announcement-eoy/"
    },
    {
        "unique_id": "bW8c9MNDCJcWF7RphDbqk",
        "card_unique_id": "frQkkTNgtwqhkN6Hgq6cj",
        "status_active": true,
        "date_announced": "2023-12-18T00:00:00.000Z",
        "date_in_effect": "2023-12-22T00:00:00.000Z",
        "legality_article": "https://fabtcg.com/articles/scheduled-banned-and-restricted-announcement-eoy/"
    },
    {
        "unique_id": "Nk7rTCmjdC7fkmMkPPCQD",
        "card_unique_id": "j8jjnw6NmpTpf9cWThfgg",
        "status_active": true,
        "date_announced": "2023-12-18T00:00:00.000Z",
        "date_in_effect": "2023-12-22T00:00:00.000Z",
        "legality_article": "https://fabtcg.com/articles/scheduled-banned-and-restricted-announcement-eoy/"
    },
    {
        "unique_id": "87qq9j9nRTHDW7Nqcmkfm",
        "card_unique_id": "HFwjczQFRKCgTFHdbjdzW",
        "status_active": true,
        "date_announced": "2023-12-18T00:00:00.000Z",
        "date_in_effect": "2023-12-22T00:00:00.000Z",
        "legality_article": "https://fabtcg.com/articles/scheduled-banned-and-restricted-announcement-eoy/"
    },
    {
        "unique_id": "998HqzjRCJpGTNGNHFPH7",
        "card_unique_id": "JfJ7hNnCDL9GDCwfrWBBc",
        "status_active": true,
        "date_announced": "2023-12-18T00:00:00.000Z",
        "date_in_effect": "2023-12-22T00:00:00.000Z",
        "legality_article": "https://fabtcg.com/articles/scheduled-banned-and-restricted-announcement-eoy/"
    },
    {
        "unique_id": "79kDq7wL6gJfwt8jQJtwQ",
        "card_unique_id": "zzHRCMBmNTF9KpJMqKWq8",
        "status_active": true,
        "date_announced": "2023-12-18T00:00:00.000Z",
        "date_in_effect": "2023-12-22T00:00:00.000Z",
        "legality_article": "https://fabtcg.com/articles/scheduled-banned-and-restricted-announcement-eoy/"
    },
    {
        "unique_id": "kwPrDHpK86qTgKfGgKhqR",
        "card_unique_id": "BkpMHRn6L8dpcgjgrPm9H",
        "status_active": true,
        "date_announced": "2023-12-18T00:00:00.000Z",
        "date_in_effect": "2023-12-22T00:00:00.000Z",
        "legality_article": "https://fabtcg.com/articles/scheduled-banned-and-restricted-announcement-eoy/"
    }
]