[
    {
        "unique_id": "MQTLKPtWrbNpRrjjPhzn8",
        "card_unique_id": "RHnFkKb8FKdFzp9rdzGjF",
        "status_active": true,
        "date_announced": "2022-04-25T00:00:00.000Z",
        "date_in_effect": "2022-05-02T00:00:00.000Z",
        "legality_article": "https://fabtcg.com/articles/scheduled-banned-suspended-announcement/"
    },
    {
        "unique_id": "fPzpnpKpJDp86fzN6GpMr",
        "card_unique_id": "RWwk8hgBdnRdWfjkrfJHt",
        "status_active": true,
        "date_announced": "2022-04-25T00:00:00.000Z",
        "date_in_effect": "2022-05-02T00:00:00.000Z",
        "legality_article": "https://fabtcg.com/articles/scheduled-banned-suspended-announcement/"
    }
]