[
    {
        "unique_id": "JGCjqRTFRgTCmw8MfwLnL",
        "card_unique_id": "nwNfL8wPDtKW9jCFktCBL",
        "status_active": true,
        "date_announced": "2022-04-22T00:00:00.000Z",
        "date_in_effect": "2022-05-02T00:00:00.000Z",
        "planned_end": "until Bravo, Star of the Show becomes Living Legend",
        "legality_article": "https://fabtcg.com/articles/scheduled-banned-suspended-announcement/"
    },
    {
        "unique_id": "KCKd9HgMBj6gjWrDTjdmp",
        "card_unique_id": "pKdGGghdpnBCzrjwPmkPg",
        "status_active": true,
        "date_announced": "2022-04-22T00:00:00.000Z",
        "date_in_effect": "2022-05-02T00:00:00.000Z",
        "planned_end": "until Bravo, Star of the Show becomes Living Legend",
        "legality_article": "https://fabtcg.com/articles/scheduled-banned-suspended-announcement/"
    },
    {
        "unique_id": "77GQLzbFmNP67r66c7gCh",
        "card_unique_id": "QqghkNGDQHkGMRGRt8pDr",
        "status_active": true,
        "date_announced": "2022-04-22T00:00:00.000Z",
        "date_in_effect": "2022-05-02T00:00:00.000Z",
        "planned_end": "until Bravo, Star of the Show becomes Living Legend",
        "legality_article": "https://fabtcg.com/articles/scheduled-banned-suspended-announcement/"
    },
    {
        "unique_id": "pnkhGKRBrpFCKmjtnBn9C",
        "card_unique_id": "nGHhHDgKmGgb7gjwWjHJF",
        "status_active": true,
        "date_announced": "2022-04-22T00:00:00.000Z",
        "date_in_effect": "2022-05-02T00:00:00.000Z",
        "planned_end": "until Viserai, Rune Blood becomes Living Legend",
        "legality_article": "https://fabtcg.com/articles/scheduled-banned-suspended-announcement/"
    },
    {
        "unique_id": "hggkqJHhzFcpTGnpGjbfp",
        "card_unique_id": "bkwMDWGMmKTMd9dKQMt76",
        "status_active": true,
        "date_announced": "2022-04-22T00:00:00.000Z",
        "date_in_effect": "2022-05-02T00:00:00.000Z",
        "planned_end": " until Chane, Bound by Shadow becomes Living Legend",
        "legality_article": "https://fabtcg.com/articles/scheduled-banned-suspended-announcement/"
    },
    {
        "unique_id": "7DHkr86cjKQnfbJRgkBHp",
        "card_unique_id": "g9ckPjGmpNNkmbgChTQNR",
        "status_active": true,
        "date_announced": "2022-04-22T00:00:00.000Z",
        "date_in_effect": "2022-05-02T00:00:00.000Z",
        "planned_end": " until Chane, Bound by Shadow becomes Living Legend",
        "legality_article": "https://fabtcg.com/articles/scheduled-banned-suspended-announcement/"
    },
    {
        "unique_id": "PDJmGJNhD6hQkmTg8pHbt",
        "card_unique_id": "BnQtggKJtBNmpqKR7NWBH",
        "status_active": true,
        "date_announced": "2022-04-22T00:00:00.000Z",
        "date_in_effect": "2022-05-02T00:00:00.000Z",
        "planned_end": " until Chane, Bound by Shadow becomes Living Legend",
        "legality_article": "https://fabtcg.com/articles/scheduled-banned-suspended-announcement/"
    },
    {
        "unique_id": "zHtrfgJtMzrRH8jCNTpJR",
        "card_unique_id": "nwNfL8wPDtKW9jCFktCBL",
        "status_active": false,
        "date_announced": "2022-06-24T00:00:00.000Z",
        "date_in_effect": "2022-06-24T00:00:00.000Z",
        "planned_end": "",
        "legality_article": "https://fabtcg.com/articles/scheduled-banned-suspended-announcement-june-2022/"
    },
    {
        "unique_id": "ChTBjFnkmbCHgDRGPz9cD",
        "card_unique_id": "pKdGGghdpnBCzrjwPmkPg",
        "status_active": false,
        "date_announced": "2022-06-24T00:00:00.000Z",
        "date_in_effect": "2022-06-24T00:00:00.000Z",
        "planned_end": "",
        "legality_article": "https://fabtcg.com/articles/scheduled-banned-suspended-announcement-june-2022/"
    },
    {
        "unique_id": "RgjMKnDRrfkLK7JRkRjbW",
        "card_unique_id": "QqghkNGDQHkGMRGRt8pDr",
        "status_active": false,
        "date_announced": "2022-06-24T00:00:00.000Z",
        "date_in_effect": "2022-06-24T00:00:00.000Z",
        "planned_end": "",
        "legality_article": "https://fabtcg.com/articles/scheduled-banned-suspended-announcement-june-2022/"
    },
    {
        "unique_id": "BpNGQRfJ8nB7tTjq7nmGq",
        "card_unique_id": "bkwMDWGMmKTMd9dKQMt76",
        "status_active": false,
        "date_announced": "2022-06-24T00:00:00.000Z",
        "date_in_effect": "2022-06-24T00:00:00.000Z",
        "planned_end": "",
        "legality_article": "https://fabtcg.com/articles/scheduled-banned-suspended-announcement-june-2022/"
    },
    {
        "unique_id": "p8D67M6FPLGtrcmHbfTHJ",
        "card_unique_id": "g9ckPjGmpNNkmbgChTQNR",
        "status_active": false,
        "date_announced": "2022-06-24T00:00:00.000Z",
        "date_in_effect": "2022-06-24T00:00:00.000Z",
        "planned_end": "",
        "legality_article": "https://fabtcg.com/articles/scheduled-banned-suspended-announcement-june-2022/"
    },
    {
        "unique_id": "PWffCmzgCpGRcPMzJ9LMD",
        "card_unique_id": "BnQtggKJtBNmpqKR7NWBH",
        "status_active": false,
        "date_announced": "2022-06-24T00:00:00.000Z",
        "date_in_effect": "2022-06-24T00:00:00.000Z",
        "planned_end": "",
        "legality_article": "https://fabtcg.com/articles/scheduled-banned-suspended-announcement-june-2022/"
    },
    {
        "unique_id": "WQ8cRRLg68HRjQpCGzcDP",
        "card_unique_id": "t6MkmHjPRNghmMcMQbqch",
        "status_active": true,
        "date_announced": "2023-01-24T00:00:00.000Z",
        "date_in_effect": "2023-01-30T00:00:00.000Z",
        "planned_end": "until Iyslander becomes Living Legend",
        "legality_article": "https://fabtcg.com/articles/banned-and-suspended-announcement/"
    },
    {
        "unique_id": "rpNWJgHdjHFhz9mQgdFHH",
        "card_unique_id": "HFwjczQFRKCgTFHdbjdzW",
        "status_active": true,
        "date_announced": "2023-01-24T00:00:00.000Z",
        "date_in_effect": "2023-01-30T00:00:00.000Z",
        "planned_end": "until Iyslander becomes Living Legend",
        "legality_article": "https://fabtcg.com/articles/banned-and-suspended-announcement/"
    },
    {
        "unique_id": "FthHcJzDRbQWgpjPmRWRP",
        "card_unique_id": "nGHhHDgKmGgb7gjwWjHJF",
        "status_active": false,
        "date_announced": "2023-07-03T00:00:00.000Z",
        "date_in_effect": "2023-07-07T00:00:00.000Z",
        "planned_end": "",
        "legality_article": "https://fabtcg.com/articles/scheduled-banned-and-suspended-announcement-july-3/"
    },
    {
        "unique_id": "TJKwqBmc86HwJnjqbpHH8",
        "card_unique_id": "FLfrm7mBczWhFLBTKmBgJ",
        "status_active": true,
        "date_announced": "2023-09-18T00:00:00.000Z",
        "date_in_effect": "2023-09-22T00:00:00.000Z",
        "planned_end": "until Lexi, Livewire becomes Living Legend",
        "legality_article": "https://fabtcg.com/articles/scheduled-banned-suspended-announcement-sep19-23/"
    },
    {
        "unique_id": "fdzN8QQLQcDqK6zrwKmTb",
        "card_unique_id": "FLfrm7mBczWhFLBTKmBgJ",
        "status_active": false,
        "date_announced": "2023-11-06T00:00:00.000Z",
        "date_in_effect": "2023-11-06T00:00:00.000Z",
        "planned_end": "",
        "legality_article": "https://fabtcg.com/articles/scheduled-banned-and-suspended-announcement-nov6/"
    },
    {
        "unique_id": "mqWkWW6p6FQzdd9bkQM7D",
        "card_unique_id": "t6MkmHjPRNghmMcMQbqch",
        "status_active": false,
        "date_announced": "2023-11-27T00:00:00.000Z",
        "date_in_effect": "2023-12-01T00:00:00.000Z",
        "planned_end": "",
        "legality_article": "https://fabtcg.com/articles/living-legends-iyslander-stormbind-kano-and-kassai-cintari-sellsword/"
    },
    {
        "unique_id": "QmJ76dRd8c8JWMRjbbP9b",
        "card_unique_id": "HFwjczQFRKCgTFHdbjdzW",
        "status_active": false,
        "date_announced": "2023-11-27T00:00:00.000Z",
        "date_in_effect": "2023-12-01T00:00:00.000Z",
        "planned_end": "",
        "legality_article": "https://fabtcg.com/articles/living-legends-iyslander-stormbind-kano-and-kassai-cintari-sellsword/"
    }
]